{
  "$schema": "https://json-schema.org/draft/2020-12/schema",
  "title": "Photolib media corpus: golden record",
  "description": "Expected metadata and capture-time resolution for one corpus file. Documented in README.md.",
  "type": "object",
  "additionalProperties": false,
  "required": ["schema_version", "path", "size", "sha256", "origin", "format", "quirks", "media", "metadata", "filename", "capture_time"],
  "properties": {
    "schema_version": {"const": 1},
    "path": {"type": "string", "minLength": 1, "description": "Path below files/, with / separators"},
    "size": {"type": "integer", "minimum": 0},
    "sha256": {"type": "string", "pattern": "^[0-9a-f]{64}$"},
    "origin": {"enum": ["synthetic", "real"], "description": "synthetic: generated by tools/corpus, placeholder payloads"},
    "original_name": {"type": "string", "description": "Name before the source mangled it; the filename rules run on this"},
    "notes": {"type": "string"},
    "format": {"$ref": "#/$defs/format"},
    "vendor": {"$ref": "#/$defs/vendor"},
    "quirks": {"type": "array", "uniqueItems": true, "items": {"$ref": "#/$defs/quirk"}},
    "media": {
      "type": "object",
      "additionalProperties": false,
      "required": ["container", "mime", "kind", "support"],
      "properties": {
        "container": {"enum": ["jpeg", "png", "gif", "bmp", "webp", "avi", "isobmff", "tiff", "psd", "raf", "ebml", "mpegts", "m2ts", "mpegps", "asf", "flv", "jxl", "svg", "pdf", "eps", "ogg", "unknown"], "description": "What the magic bytes say, whatever the extension"},
        "brand": {"type": "string", "description": "ISOBMFF major brand"},
        "mime": {"type": "string", "pattern": "^[a-z]+/[a-z0-9.+-]+$"},
        "kind": {"enum": ["image", "video", "audio", "document", "unknown"]},
        "support": {"enum": ["supported", "unsupported"], "description": "unsupported files are listed, never dropped (FMT-21)"}
      }
    },
    "metadata": {
      "type": "object",
      "additionalProperties": false,
      "properties": {
        "width": {"type": "integer", "minimum": 1, "description": "Stored pixels, before orientation"},
        "height": {"type": "integer", "minimum": 1},
        "orientation": {"type": "integer", "minimum": 1, "maximum": 8, "description": "EXIF numbering; HEIF irot/imir and video rotation map onto it"},
        "make": {"type": "string"},
        "model": {"type": "string"},
        "gps": {
          "type": "object",
          "additionalProperties": false,
          "required": ["lat", "lon"],
          "properties": {"lat": {"type": "number", "minimum": -90, "maximum": 90}, "lon": {"type": "number", "minimum": -180, "maximum": 180}}
        },
        "duration_ms": {"type": "integer", "minimum": 0},
        "codec": {"enum": ["h264", "hevc", "av1", "vp8", "vp9", "mpeg2", "mjpeg", "xvid", "dv", "h263", "prores", "wmv", "flv1"]},
        "motion": {
          "type": "object",
          "additionalProperties": false,
          "required": ["offset", "length"],
          "properties": {"offset": {"type": "integer", "minimum": 0}, "length": {"type": "integer", "minimum": 1}},
          "description": "Byte range of the embedded video"
        },
        "pano": {
          "type": "object",
          "additionalProperties": false,
          "required": ["projection", "cropped"],
          "properties": {
            "projection": {"enum": ["equirectangular", "cubemap"]},
            "cropped": {"type": "boolean"},
            "heading": {"type": "number", "minimum": 0, "exclusiveMaximum": 360, "description": "GPano PoseHeadingDegrees"}
          }
        }
      }
    },
    "group": {
      "type": "object",
      "additionalProperties": false,
      "required": ["kind", "key", "role"],
      "properties": {
        "kind": {"enum": ["live_photo", "raw_jpeg", "burst", "edited_variant", "lens_pair", "camera_aux"]},
        "key": {"type": ["string", "null"], "description": "Identifier shared by the group, such as the Live Photo ContentIdentifier"},
        "role": {"enum": ["primary", "live_motion", "raw_alt", "edited_render", "camera_aux", "lens", "burst_cover", "burst_member"]}
      }
    },
    "sidecars": {
      "type": "array",
      "items": {
        "type": "object",
        "additionalProperties": false,
        "required": ["path", "kind", "sha256"],
        "properties": {"path": {"type": "string"}, "kind": {"enum": ["takeout_json", "xmp", "aae"]}, "sha256": {"type": "string", "pattern": "^[0-9a-f]{64}$"}}
      }
    },
    "filename": {
      "type": "object",
      "additionalProperties": false,
      "required": ["matches"],
      "properties": {"matches": {"type": "array", "uniqueItems": true, "items": {"type": "string", "pattern": "^F(0[1-9]|[1-4][0-9]|5[0-6])$"}, "description": "Every filename rule (F01..F56) matching the name, in registry order"}}
    },
    "capture_time": {
      "type": "object",
      "additionalProperties": false,
      "required": ["claims", "resolved"],
      "properties": {
        "claims": {"type": "array", "items": {"$ref": "#/$defs/claim"}, "description": "Claims a parser must extract; it may produce more"},
        "resolved": {
          "type": ["object", "null"],
          "additionalProperties": false,
          "required": ["local", "utc", "offset", "tz_source", "precision", "bound", "source", "confidence_band", "flags"],
          "description": "Outcome the resolver must reach; null when the file holds no usable time evidence",
          "properties": {
            "local": {"type": ["string", "null"], "pattern": "^\\d{4}(-\\d{2}(-\\d{2}(T\\d{2}:\\d{2}(:\\d{2}(\\.\\d{3})?)?)?)?)?$", "description": "Wall clock cut to precision; null when only a UTC instant is known"},
            "utc": {"type": ["string", "null"], "pattern": "^\\d{4}-\\d{2}-\\d{2}T\\d{2}:\\d{2}:\\d{2}(\\.\\d{3})?Z$"},
            "offset": {"type": ["string", "null"], "pattern": "^[+-]\\d{2}:\\d{2}$"},
            "tz_source": {"enum": ["explicit_offset", "source_app_tz", "gps_polygon", "gps_delta", "paired_utc_delta", "mtime_delta", "session_neighbour", "device_default", "floating"]},
            "precision": {"$ref": "#/$defs/precision"},
            "bound": {"enum": ["exact", "upper"], "description": "upper: the file was taken on or before this time"},
            "source": {"type": "string", "description": "Source of the winning claim; one of the claims"},
            "confidence_band": {"enum": ["high", "medium", "low"], "description": "high >= 0.85, medium >= 0.5, low below"},
            "flags": {"type": "array", "uniqueItems": true, "items": {"enum": ["dst_ambiguous", "needs_review", "capture_after_receive", "zone_mismatch"]}}
          }
        }
      }
    }
  },
  "$defs": {
    "precision": {"enum": ["ms", "s", "min", "day", "month", "year"]},
    "claim": {
      "type": "object",
      "additionalProperties": false,
      "required": ["source", "kind", "value", "precision", "event"],
      "properties": {
        "source": {"type": "string", "pattern": "^(exif_dto_with_offset|exif_dto_no_offset|exif_createdate|gps_datetime|xmp_date_with_offset|qt_keys_creationdate|qt_mvhd_phone|qt_mvhd_camera|takeout_photoTakenTime|path:(ymd|ym|y)|filename:F(0[1-9]|[1-4][0-9]|5[0-6]))$"},
        "kind": {"enum": ["local", "utc"], "description": "utc values end in Z; local values carry no zone"},
        "value": {"type": ["string", "null"], "pattern": "^\\d{4}(-\\d{2}(-\\d{2}(T\\d{2}:\\d{2}(:\\d{2}(\\.\\d{3})?)?)?)?)?Z?$", "description": "null when the name is ambiguous"},
        "offset": {"type": ["string", "null"], "pattern": "^[+-]\\d{2}:\\d{2}$", "description": "Explicit offset stored with a local value"},
        "precision": {"type": ["string", "null"], "enum": ["ms", "s", "min", "day", "month", "year", null]},
        "event": {"enum": ["capture", "receive", "save", "scan", "transfer", "record_start"]},
        "rejected": {"enum": ["sentinel", "invalid", "out_of_range", "ambiguous_order", "no_year"], "description": "Why the resolver must drop the claim"}
      }
    },
    "format": {"enum": ["jpeg", "png", "bmp", "webp", "gif", "apng", "heic", "avif", "jxl", "tiff", "psd", "psb", "cr2", "cr3", "nef", "arw", "raf", "orf", "rw2", "pef", "dng", "svg", "pdf", "eps", "mp4", "mov", "mkv", "webm", "mts", "m2ts", "avi", "3gp", "wmv", "mpeg", "flv", "insp", "insv", "lrv", "lrf", "thm", "unknown"]},
    "vendor": {"enum": ["apple", "google", "samsung", "huawei", "xiaomi", "oneplus", "motorola", "sony", "canon", "nikon", "fujifilm", "olympus", "panasonic", "pentax", "gopro", "dji", "insta360", "epson", "microsoft"]},
    "quirk": {"enum": [
      "progressive", "cmyk", "mpf", "exif_big_endian", "alpha", "lossless", "animated", "bit_depth_10", "bit_depth_12", "bit_depth_16", "float", "multipage", "bigtiff",
      "heif_grid", "heif_irot", "heif_imir", "heif_clap", "heif_aux_image", "jxl_recompressed_jpeg", "dng_jxl", "proraw", "embedded_preview", "interlaced",
      "ultra_hdr", "gain_map_iso", "gain_map_apple", "gain_map_samsung", "hdr_pq", "hdr_hlg", "dolby_vision", "hdr10", "hdr10_plus",
      "exif_orientation", "video_rotation", "extension_mismatch", "no_extension", "trailing_data", "truncated_file", "unknown_type",
      "live_photo", "motion_photo_v1", "micro_video", "motion_photo_mpvd", "motion_photo_sef", "motion_flag_stale", "burst", "raw_jpeg_pair", "edited_render", "sidecar_xmp", "sidecar_aae",
      "photo_sphere", "photo_sphere_cropped", "flat_panorama", "spherical_video_v2", "spherical_video_v2_bounds", "spherical_video_v1", "stereo_top_bottom", "stereo_left_right", "cubemap",
      "spatial_video", "spatial_photo", "depth_apple", "depth_gdepth", "depth_dynamic", "depth_samsung", "camera_proxy", "lens_pair", "slow_motion", "slow_motion_sef",
      "exif_missing", "exif_truncated", "exif_bad_offset", "exif_sentinel_date", "exif_invalid_date", "exif_nonsense_offset", "exif_future_date", "exif_garbage_text",
      "mvhd_zero", "mvhd_out_of_range", "gps_null_island", "pixel_utc_name", "epoch_name", "two_digit_year", "ambiguous_date_order", "counter_not_time", "localized_name",
      "path_date", "time_conflict", "dst_overlap", "upper_bound_name", "scan", "screenshot", "screen_recording",
      "takeout_truncated_name", "takeout_duplicate_counter", "takeout_edited", "takeout_supplemental_sidecar", "takeout_legacy_sidecar", "takeout_extension_dropped",
      "takeout_case_drift", "takeout_live_video", "takeout_year_folder", "takeout_localized_folder", "takeout_no_sidecar", "takeout_geo_zero",
      "messenger_copy", "exif_stripped"
    ]}
  }
}
