{
  "schema_version": 1,
  "path": "names/Photo on 12-31-23 at 12.34 PM.jpg",
  "size": 3451,
  "sha256": "cc3bc06987b8114b4d4dbcc0d87f42238ec3364b500741d3422dfe665aec8243",
  "origin": "synthetic",
  "format": "jpeg",
  "quirks": [
    "two_digit_year"
  ],
  "media": {
    "container": "jpeg",
    "mime": "image/jpeg",
    "kind": "image",
    "support": "supported"
  },
  "metadata": {
    "width": 640,
    "height": 480
  },
  "filename": {
    "matches": [
      "F51"
    ]
  },
  "capture_time": {
    "claims": [
      {
        "source": "filename:F51",
        "kind": "local",
        "value": "2023-12-31T12:34",
        "precision": "min",
        "event": "capture"
      }
    ],
    "resolved": {
      "local": "2023-12-31T12:34",
      "utc": null,
      "offset": null,
      "tz_source": "floating",
      "precision": "min",
      "bound": "exact",
      "source": "filename:F51",
      "confidence_band": "medium",
      "flags": []
    }
  }
}
