{
  "schema_version": 1,
  "path": "compound/odd/heic-saved-as.jpg",
  "size": 798,
  "sha256": "77156a70077996cb0dab093543c0fe683f2a1ad14b4490fa124f875fea80511a",
  "origin": "synthetic",
  "notes": "Placeholder HEVC payload: the structure and metadata are real, the image does not decode.",
  "format": "heic",
  "vendor": "apple",
  "quirks": [
    "extension_mismatch"
  ],
  "media": {
    "container": "isobmff",
    "brand": "heic",
    "mime": "image/heic",
    "kind": "image",
    "support": "supported"
  },
  "metadata": {
    "width": 4032,
    "height": 3024,
    "make": "Apple",
    "model": "iPhone 13 Pro",
    "gps": {
      "lat": 48.8584,
      "lon": 2.2945
    }
  },
  "filename": {
    "matches": []
  },
  "capture_time": {
    "claims": [
      {
        "source": "exif_dto_with_offset",
        "kind": "local",
        "value": "2022-02-02T14:00:00",
        "precision": "s",
        "event": "capture",
        "offset": "+01:00"
      },
      {
        "source": "gps_datetime",
        "kind": "utc",
        "value": "2021-07-14T10:15:42Z",
        "precision": "s",
        "event": "capture"
      }
    ],
    "resolved": {
      "local": "2022-02-02T14:00:00",
      "utc": "2022-02-02T13:00:00Z",
      "offset": "+01:00",
      "tz_source": "explicit_offset",
      "precision": "s",
      "bound": "exact",
      "source": "exif_dto_with_offset",
      "confidence_band": "high",
      "flags": []
    }
  }
}
