{
  "schema_version": 1,
  "path": "video/iphone-dolby-vision.mov",
  "size": 936,
  "sha256": "c11e9f58582cd56d85d9c697d11d12974f26adccbaf982ca6edc1ba990228f71",
  "origin": "synthetic",
  "notes": "Placeholder hevc payload: the structure and metadata are real, the video does not decode.",
  "format": "mov",
  "vendor": "apple",
  "quirks": [
    "dolby_vision"
  ],
  "media": {
    "container": "isobmff",
    "brand": "qt  ",
    "mime": "video/quicktime",
    "kind": "video",
    "support": "supported"
  },
  "metadata": {
    "width": 1920,
    "height": 1080,
    "duration_ms": 3000,
    "codec": "hevc",
    "make": "Apple",
    "model": "iPhone 13 Pro"
  },
  "filename": {
    "matches": []
  },
  "capture_time": {
    "claims": [
      {
        "source": "qt_keys_creationdate",
        "kind": "local",
        "value": "2022-03-05T01:05:00",
        "precision": "s",
        "event": "record_start",
        "offset": "-08:00"
      },
      {
        "source": "qt_mvhd_phone",
        "kind": "utc",
        "value": "2022-03-05T09:05:00Z",
        "precision": "s",
        "event": "record_start"
      }
    ],
    "resolved": {
      "local": "2022-03-05T01:05:00",
      "utc": "2022-03-05T09:05:00Z",
      "offset": "-08:00",
      "tz_source": "explicit_offset",
      "precision": "s",
      "bound": "exact",
      "source": "qt_keys_creationdate",
      "confidence_band": "high",
      "flags": []
    }
  }
}
