{
  "schema_version": 1,
  "path": "compound/sphere/stereo-left-right.mp4",
  "size": 764,
  "sha256": "54002299548e9d21cc23d6b773a787974e6caed25c86af769dba2e8cd88f46a9",
  "origin": "synthetic",
  "notes": "Placeholder h264 payload: the structure and metadata are real, the video does not decode.",
  "format": "mp4",
  "vendor": "canon",
  "quirks": [
    "stereo_left_right"
  ],
  "media": {
    "container": "isobmff",
    "brand": "isom",
    "mime": "video/mp4",
    "kind": "video",
    "support": "supported"
  },
  "metadata": {
    "width": 1920,
    "height": 1080,
    "duration_ms": 3000,
    "codec": "h264",
    "make": "Canon",
    "model": "EOS R5"
  },
  "filename": {
    "matches": []
  },
  "capture_time": {
    "claims": [
      {
        "source": "qt_mvhd_camera",
        "kind": "local",
        "value": "2021-02-14T10:05:00",
        "precision": "s",
        "event": "record_start"
      }
    ],
    "resolved": {
      "local": "2021-02-14T10:05:00",
      "utc": null,
      "offset": null,
      "tz_source": "floating",
      "precision": "s",
      "bound": "exact",
      "source": "qt_mvhd_camera",
      "confidence_band": "medium",
      "flags": []
    }
  }
}
