{
  "schema_version": 1,
  "path": "names/IMG_20190509_154735~2.jpg",
  "size": 3387,
  "sha256": "0c6b9ff8c84c1e2748e8329fc2e83472aee6d807565df5ecba0779b66c6b71d4",
  "origin": "synthetic",
  "format": "jpeg",
  "quirks": [],
  "media": {
    "container": "jpeg",
    "mime": "image/jpeg",
    "kind": "image",
    "support": "supported"
  },
  "metadata": {
    "width": 640,
    "height": 480
  },
  "filename": {
    "matches": [
      "F01",
      "F02",
      "F52"
    ]
  },
  "capture_time": {
    "claims": [
      {
        "source": "filename:F01",
        "kind": "local",
        "value": "2019-05-09T15:47:35",
        "precision": "s",
        "event": "capture"
      }
    ],
    "resolved": {
      "local": "2019-05-09T15:47:35",
      "utc": null,
      "offset": null,
      "tz_source": "floating",
      "precision": "s",
      "bound": "exact",
      "source": "filename:F01",
      "confidence_band": "medium",
      "flags": []
    }
  }
}
