{
  "schema_version": 1,
  "path": "takeout/Google Photos/Fotos von 2019/IMG_20190512_100000.jpg",
  "size": 3379,
  "sha256": "aea19428de48c215ecf1d568a7366c6211fd416a1bb5a99ae58280010c164d2e",
  "origin": "synthetic",
  "format": "jpeg",
  "quirks": [
    "takeout_geo_zero",
    "takeout_legacy_sidecar",
    "takeout_localized_folder"
  ],
  "media": {
    "container": "jpeg",
    "mime": "image/jpeg",
    "kind": "image",
    "support": "supported"
  },
  "metadata": {
    "width": 640,
    "height": 480
  },
  "sidecars": [
    {
      "path": "takeout/Google Photos/Fotos von 2019/IMG_20190512_100000.jpg.json",
      "kind": "takeout_json",
      "sha256": "147ed2b4d0eb2d14d258f09f8cdc6ed0d1f36d9f49cc3c5e4bb72e3d1a359e5e"
    }
  ],
  "filename": {
    "matches": [
      "F01",
      "F02",
      "F50",
      "F52"
    ]
  },
  "capture_time": {
    "claims": [
      {
        "source": "takeout_photoTakenTime",
        "kind": "utc",
        "value": "2019-05-12T08:00:00Z",
        "precision": "s",
        "event": "capture"
      },
      {
        "source": "filename:F01",
        "kind": "local",
        "value": "2019-05-12T10:00:00",
        "precision": "s",
        "event": "capture"
      }
    ],
    "resolved": {
      "local": "2019-05-12T10:00:00",
      "utc": "2019-05-12T08:00:00Z",
      "offset": "+02:00",
      "tz_source": "paired_utc_delta",
      "precision": "s",
      "bound": "exact",
      "source": "filename:F01",
      "confidence_band": "medium",
      "flags": []
    }
  }
}
