{
  "schema_version": 1,
  "path": "time/video-2011-09-25-18-58-53.mp4",
  "size": 747,
  "sha256": "c8cd88cda5063065fabd08e93ccea75a2e1edd409124478ce4dd317961f6cf06",
  "origin": "synthetic",
  "notes": "Placeholder h264 payload: the structure and metadata are real, the video does not decode.",
  "format": "mp4",
  "quirks": [
    "mvhd_zero"
  ],
  "media": {
    "container": "isobmff",
    "brand": "isom",
    "mime": "video/mp4",
    "kind": "video",
    "support": "supported"
  },
  "metadata": {
    "width": 1920,
    "height": 1080,
    "duration_ms": 3000,
    "codec": "h264"
  },
  "filename": {
    "matches": [
      "F52",
      "F54"
    ]
  },
  "capture_time": {
    "claims": [
      {
        "source": "filename:F52",
        "kind": "local",
        "value": "2011-09-25T18:58:53",
        "precision": "s",
        "event": "record_start"
      }
    ],
    "resolved": {
      "local": "2011-09-25T18:58:53",
      "utc": null,
      "offset": null,
      "tz_source": "floating",
      "precision": "s",
      "bound": "exact",
      "source": "filename:F52",
      "confidence_band": "medium",
      "flags": []
    }
  }
}
